{
  "section_id": "w-1-09",
  "verdict": "PASS",
  "spot_checked": [
    "save_points: Hotel ground floor",
    "enemies table: #034 Corporal 70 Earth, #035 Sergeant 160 Light",
    "step 1 hotel/Zhen's bar events and Corporals note (random battles, talking triggers fight)",
    "step 2 Kato, Kuihai Tower key, dock/ship, fish well left side, Yawang Gate Key wrapped in cloth",
    "step 3 Inn second floor back room, couple of Sergeants",
    "step 5 three dialogue prompts: all 9 options present, correct required answers (1,1,1), missable Kowloon side quest warning",
    "step 6 leave Kuihai Tower, return to Huayuan",
    "step 7 Mika's House fork, previously locked building, cabinet with bird cage, Tea of the Healer (space-split of TeaOfTheHealer)",
    "step 8 Man with Dog, 300 Cash, prizes: Lottery Ticket (first, three dogs), Leonardo's Bear (second, four dogs), Monkey Paw (third, four dogs)",
    "step 9 W-1-11 Kuihai Tower reference and side quest branch",
    "items_summary covers all 5 overview items/equipment/valuables with correct categories",
    "step order matches canonical order"
  ],
  "findings": [],
  "structured_sha256": "8c353115f50f591da3d991abcb47b57e7b75eec800b071c123371a75fd323309"
}
