{
  "section_id": "w-1-11",
  "verdict": "PASS_WITH_NOTES",
  "structured_sha256": "ce0aa99547021d34db267a953a98b75a48977aa7a1337de42ac7b04ee53f7ef0",
  "spot_checked": [
    "Overview save points (3), lottery member, items and valuables lists",
    "Enemy table: all 10 rows (numbers, HP, class, notes incl. Ring anomalies and Petrification & Silence)",
    "Shop inventory: all 35 items and prices, shop name",
    "Step 1 loot order (Seal of Life, Third Key, 15,000+ cash note)",
    "Step 3 full loot sequence (clockwise chest, eastern staircase, Black Tortoise, Pure Extract, B. Dragon VP, 10,000 cash note)",
    "Steps 4-7 puzzle order (Erotic Book, R. Phoenix/Blue Dragon, W. Tiger/Red Phoenix, White Tiger swap, Blue Dragon altar)",
    "Step 9 point-of-no-return note and Graveyard reminder",
    "Step 11-12 party choice, Hermit's Staff, Lottery Member No. 09 prize table (5 colors)",
    "Step 13 shop advice (Bell/Mirror Bracelets, Petrification and Silence)",
    "Step 14 save instruction and temporary party-member note",
    "Boss stats, EXP, cash, drops and party levels/equipment/fusions for Yamaraja: Stone, Badger Devil, Dehuai, Yamaraja: Calamity",
    "Boss strategy text for all four bosses, including the Badger Devil Instant Death options and Yamaraja: Calamity healing/MP advice",
    "Boss coverage: all four canonical bosses present as step.boss (steps 2, 8, 10, 14)"
  ],
  "findings": [
    {
      "severity": "low",
      "category": "other",
      "location": "navigation.next",
      "canonical": "w-2-00 \"Walkthrough - Europe\" (sections/w-2-00-walkthrough-europe.json)",
      "structured": "w-2-01 \"Prague (1)\" (sections/w-2-01-prague-1.json)",
      "issue": "The structured next link skips the canonical next target w-2-00. No structured file exists for w-2-00 (its canonical source does), so the skip may be deliberate, but it diverges from the canonical navigation without a note. Navigation metadata only; no game content affected. Caller to confirm the intended target."
    },
    {
      "severity": "low",
      "category": "other",
      "location": "items_summary, items, shops[0].inventory, steps[*].rewards",
      "canonical": "TalismanOfWisdom, TalismanOfLuck, TalismanOfMercy, RosewoodBracelet (raw all-caps/run-together tags)",
      "structured": "Talisman of Wisdom, Talisman of Luck, Talisman of Mercy, Rosewood Bracelet",
      "issue": "Item names were re-spaced to readable form. The same item in the same place, so no fact changed, but it is a name-spelling normalization rather than a verbatim copy. Acceptable as presentation; noted for awareness given the no-renaming rule."
    }
  ]
}
