{
  "section_id": "w-s-16",
  "verdict": "PASS",
  "structured_sha256": "6dc0b150c68514c9ece67d8cb24d5aca8159e4af3b57f8390f8f2dbafe41170a",
  "spot_checked": [
    "boss strategy regroup (Ben / Malcto / Strategy / Trouble): all source sentences present, wording unchanged, order preserved",
    "boss stats (2000/5000 HP, Dark/None, Diamond Ring drop, Yuri L52 gear and fusions, 60000 EXP, 99999 Cash)",
    "prerequisite note (5 conditions) and pre-battle Graveyard note",
    "Ancient Ruins 7-step colour/room order",
    "Lottery Member No. 00 prize table and Europe/Asia member list incl. No. 02 conditions",
    "rewards: Pulse Tract, Nightbird Claw, Stone of Rebirth, Seraphic Radiance, Father's Coat",
    "save prompts (before Neameeto question, before Graveyard) and the 1/2 choice",
    "closing cross-reference [W-2-17] Neameeto resolves to existing section w-2-17"
  ],
  "findings": [
    {
      "severity": "low",
      "category": "other",
      "location": "steps[11].boss.strategy (labels 'Ben', 'Malcto', 'Strategy', 'Trouble')",
      "canonical": "Unlabelled paragraphs inside the boss box",
      "structured": "Bold group labels added; 'Malcto' label sits over the sentence naming Malcto",
      "issue": "Labels are presentation-only and derived from source wording; no facts, numbers or order changed. The truncated source fragment ('---' marker line) is correctly dropped. Informational only."
    }
  ]
}
