{
  "section_id": "w-s-09",
  "verdict": "PASS_WITH_NOTES",
  "spot_checked": [
    "boss strategy sentences vs canonical (all present, wording unchanged, order preserved)",
    "boss exp/cash/hp/class/drop",
    "enemy table",
    "save points",
    "steps 1-7 order and conditions (Keith in party, 5/6 turns, Keith swapped out for lottery, 20% figures)",
    "lottery prize table (Red/Yellow/Turquoise/Green/White)"
  ],
  "findings": [
    {
      "severity": "low",
      "category": "altered",
      "location": "step 3 description/rewards/boss.drop, items_summary",
      "canonical": "DemonSwd-Tyrving",
      "structured": "Demon Swd-Tyrving",
      "issue": "Item name gets a space inserted in most places, while the boss strategy note keeps DemonSwd-Tyrving. The name is inconsistent within the section and differs from the source spelling."
    },
    {
      "severity": "low",
      "category": "other",
      "location": "items_summary.obtainable[2]",
      "canonical": "Lottery: Lottery Member No. 01 (Keith-like invisible man)",
      "structured": "'(Keith-like invisible man)' listed as a separate obtainable lottery item",
      "issue": "The parenthetical describes Lottery Member No. 01 and is not a separate obtainable. It is split into its own entry with a location sentence built from step text."
    }
  ],
  "structured_sha256": "980141c4de0484ad8ca4170aa66be963ea092e83915b0e145a3ae773a81cacad"
}
