{
  "section_id": "w-2-16",
  "verdict": "PASS",
  "structured_sha256": "522cd9766cb07aa2f0806551fa6359ca4c3747a9611efe13a5de598cc0dee734",
  "spot_checked": [
    "Silent Peddler / Thera Extracts / Pedometer+Accelerator parenthetical",
    "Meiyuan Acupuncture: Hit Area / Attack Power",
    "shopping list quantities and vendors (Peddler 50+, Roger 50+, Tight-lipped Merchant Prague 10-15/25/5-10/5-10)",
    "Pirate Earrings 5 or 4+Thief Earrings 100% drop note",
    "Yuri ???? Fusion skills via Berserk",
    "level targets Alice 48, Zhuzhen 47, Margarete 46, Keith 49, Halley 47",
    "grinding equipment list and +140% Cash / double steps / +40% EXP",
    "min level 40, party split warning, ordering of all 8 steps"
  ],
  "findings": []
}
