{
  "section_id": "w-2-15",
  "verdict": "PASS",
  "spot_checked": [
    "lead-in 'Only one side quest left!' preserved in first block text",
    "block title [W-S-16] Nemeton Monastery (The Seraphic Radiance / Yuri's Weapon & Armor / Lottery Member #0) matches canonical hub teaser",
    "Yuri's best Fusion, best weapon and armor preserved",
    "Lottery Chairman meeting preserved",
    "navigation prev w-2-14 / next w-s-16 matches canonical"
  ],
  "findings": [],
  "structured_sha256": "68443aa07b4963996265e63f19fe27524e0cd1515122133d1c003753b67fa253"
}
